{
  "$schema": "https://json-schema.org/draft/2020-12/schema",
  "$id": "https://truth-tools.dev/schemas/status-artifact.schema.json",
  "title": "StatusArtifact",
  "description": "StatusArtifact v2.0.0 is the canonical metadata-only input. Legacy 1.0.0 input is accepted only through a visible migration/deprecation compatibility path. Bodies stay in their system of record.",
  "type": "object",
  "additionalProperties": false,
  "required": ["kind", "schema_version", "as_of", "initiative", "policy", "sources", "claims", "health_assessment"],
  "properties": {
    "kind": {
      "const": "status_artifact"
    },
    "schema_version": {
      "const": "2.0.0"
    },
    "as_of": {
      "type": "string",
      "pattern": "^\\d{4}-\\d{2}-\\d{2}(T\\d{2}:\\d{2}:\\d{2}(\\.\\d{1,9})?(Z|[+-]\\d{2}:\\d{2}))?$",
      "description": "Reproducible review cutoff timestamp; required so evidence-age checks are deterministic."
    },
    "initiative": {
      "type": "object",
      "additionalProperties": false,
      "required": ["name"],
      "properties": {
        "name": { "type": "string", "minLength": 1 },
        "owner": { "type": "string", "minLength": 1 },
        "objective": { "type": "string", "minLength": 1 }
      }
    },
    "policy": {
      "type": "object",
      "additionalProperties": false,
      "required": ["max_observation_age_days", "max_source_content_age_days"],
      "properties": {
        "max_observation_age_days": {
          "type": "integer",
          "minimum": 0,
          "default": 14,
          "description": "Maximum allowed age of the observed_at snapshot in days; older observations raise stale_observation."
        },
        "max_source_content_age_days": {
          "type": "integer",
          "minimum": 0,
          "default": 14,
          "description": "Maximum allowed age of the source content (source_updated_at) in days; older content raises stale_source_content."
        }
      }
    },
    "sources": {
      "type": "array",
      "minItems": 1,
      "maxItems": 1000,
      "items": {
        "$ref": "https://truth-tools.dev/schemas/source.schema.json"
      }
    },
    "claims": {
      "type": "array",
      "minItems": 1,
      "maxItems": 5000,
      "items": {
        "$ref": "https://truth-tools.dev/schemas/claim.schema.json"
      },
      "description": "Reviewed claims only; candidate capture output must be promoted to Claims first."
    },
    "health_assessment": {
      "$ref": "https://truth-tools.dev/schemas/health-assessment.schema.json",
      "description": "Explicit reported health. Facts alone never imply on_track. An active blocker always resolves program_health to blocked; if the reported state is on_track or at_risk, the health consistency is conflicting and artifact_quality is fail."
    },
    "timeline": {
      "type": "array",
      "maxItems": 500,
      "items": {
        "$ref": "https://truth-tools.dev/schemas/timeline-item.schema.json"
      },
      "description": "Current plan timeline."
    },
    "baseline_timeline": {
      "type": "array",
      "maxItems": 500,
      "items": {
        "$ref": "https://truth-tools.dev/schemas/timeline-item.schema.json"
      },
      "description": "Baseline plan timeline; when both timelines are present the review reports timeline drift."
    }
  }
}
